Name,Emulated,ReleaseDate,Developer,Manufacturer,Cpu,Memory,Graphics,Sound,Display,Media,MaxControllers,Notes,Category
Sony Playstation 3,true,2006-11-11,SCEI,"Sony EMCS, Foxconn, ASUSTeK",3.2 GHz Cell Broadband Engine with 1 PPE & 7 SPEs,256 MB system and 256 MB video,"550 MHz NVIDIA/SCEI RSX ""Reality Synthesizer""","Analog stereo TOSLINK LPCM 2ch 44.1 kHz, 48 kHz, 88 kHz, 176.4 kHz, Dolby Digital 5.1, DTS 5.1 AAC","Composite, S-Video, RGB, Component, D-Terminal, HDMI",Blu-Ray,7,"The Sony PlayStation 3, or PS3 for short, is a seventh generation (2005–2017) home video game console developed and distributed by Sony Interactive Entertainment. It was released on November 11, 2006 in Japan at a retail price of ¥59,800. The console was later released in North America (2006), Europe (2007), and Australia (2007). The PlayStation 3 was the first console to use Blu-ray Disc as its primary storage medium. The console was discontinued on May 29, 2017.",Consoles
Sony Playstation 4,true,2013-11-15,Sony,"Sony, Foxconn","Semi-custom 8-core AMD x86-64 Jaguar CPU (integrated into APU), Secondary low power processor (for background tasks)","8 GB GDDR5 (unified), 256 MB DDR3 RAM (for background tasks)",Semi-custom AMD GCN Radeon (integrated into APU),AMD TrueAudio,HDMI up to 4K,Blu-Ray,4,"The Sony PlayStation 4, or PS4 for short, is an eighth generation (2012-present) home video game console developed and distributed by Sony Interactive Entertainment. It was released on November 15, 2013 in North America at a retail price of $399.99. The console was later released in Europe (2013), South America (2013), Australia (2013) and Japan (2014). The PlayStation 4 places an increased emphasis on social interaction and integration with other devices and services, including the ability to play games off-console on PlayStation Vita and other supported devices via Remote Play. As of this date, the console is still in production.",Consoles
Sony Playstation Vita,true,2011-12-17,Sony,Sony,4 core ARM Cortex-A9 MPCore,"512 MB RAM, 128 MB VRAM",4 core SGX543MP4+,Stereo speakers,960x544,Cartridge,1,"The PlayStation Vita is a handheld game console manufactured and marketed by Sony Computer Entertainment. It is the successor to the PlayStation Portable.

The handheld includes two analog sticks, a 5-inch (130 mm) OLED multi-touch capacitive touchscreen, and supports Bluetooth, Wi-Fi and optional 3G.",Handhelds
Sony PSP,true,2004-12-12,Sony,Sony,Sony CXD2962GG (based on MIPS R4000 core),32 MB,Sony CXD187,Embedded VME sound core,480x272,UMD disc,1,"The PlayStation Portable (PSP) is a handheld game console developed by Sony. Development of the handheld was announced during E3 2003, and it was unveiled on May 11, 2004, at a Sony press conference before E3 2004. The system was released in Japan on December 12, 2004, in North America on March 24, 2005, and in the PAL region on September 1, 2005. It primarily competed with the Nintendo DS, as part of the seventh generation of video games.  The PlayStation Portable became the most powerful portable system when launched, just after the Nintendo DS in 2004. It was the first real competitor to Nintendo's handheld domination, where many challengers, such as SNK's Neo Geo Pocket and Nokia's N-Gage, failed. Its GPU encompassed high-end graphics on a handheld, while its 4.3 inch viewing screen and multi-media capabilities, such as its video player and TV tuner, made the PlayStation Portable a major mobile entertainment device at the time. It also features connectivity with the PlayStation 3, other PSPs and the Internet. It is the only handheld console to use an optical disc format, Universal Media Disc (UMD), as its primary storage medium.  The original PSP model (PSP-1000) was replaced by a slimmer model with design changes (PSP-2000/""Slim & Lite"") in 2007. Another remodeling followed in 2008, PSP-3000, which included a new screen and an inbuilt microphone. A complete redesign, PSP Go, came in 2009, followed by a budget model, PSP-E1000, in 2011. The PSP line was succeeded by the PlayStation Vita, released in December 2011 in Japan, and in February 2012 worldwide. The PlayStation Vita features backward compatibility with many PlayStation Portable games digitally released on the PlayStation Network, via PlayStation Store. Shipments of the PlayStation Portable ended throughout 2014 worldwide, having sold 80 million units in its 10-year lifetime.",Handhelds
Super Nintendo Entertainment System,true,1990-11-21,Nintendo,Nintendo,Ricoh 5A22,"Main 128 KB DRAM, Video 64 KB SRAM",16 bit PPU,Sony SPC700 and Sony DSP,512x478 max,ROM cartridge,2,"The Super Nintendo Entertainment System (also known as the Super NES, SNES or Super Nintendo) is a 16-bit home video game console developed by Nintendo that was released in 1990 in Japan, 1991 in North America, 1992 in Europe and Australasia (Oceania), and 1993 in South America.

In Japan, the system is called the Super Famicom, officially adopting the abbreviated name of its predecessor, the Family Computer, or SFC for short.

In South Korea, it is known as the Super Comboy and was distributed by Hyundai Electronics.

Although each version is essentially the same, several forms of regional lockout prevent the different versions from being compatible with one another.",Consoles
NEC TurboGrafx-16,true,1989-08-29,"NEC Corporation, Hudson Soft","NEC Corporation, Hudson Soft",8-bit Hudson HuC6280 @ 7.16 MHz,"8 KB RAM, 64 KB video RAM",16-bit Hudson HuC6270 @ 10 MHz,6 PSG audio channels,"256x224p, 352x224p, 512x224p, 256x240p, 352x240p, 512x240p, 256x448i, 352x448i, 512x448i, 256x480i, 352x480i, 512x480i",HuCards (aka Turbo Chips),1 (up to 5 with TurboTap),"TurboGrafx-16, fully titled as TurboGrafx-16 Entertainment SuperSystem and known in Japan as the PC Engine, is a video game console developed by Hudson Soft and NEC, released in Japan on October 30, 1987, and in North America on August 29, 1989.",Consoles
WonderSwan,true,1999-03-04,"Bandai Co., Ltd.","Bandai Co., Ltd.",NEC V30MZ @ 3 MHz,64 KB,8 Shades of Gray,4 channels,224x144,Cartridge,1,"The WonderSwan is a handheld game console released in Japan by Bandai. It was developed by Gunpei Yokoi's company Koto Laboratory and Bandai, and was the last piece of hardware Yokoi developed before his death in 1997. Released in 1999 in the fifth generation of video game consoles, the WonderSwan and its two later models, the WonderSwan Color and SwanCrystal were officially supported until being discontinued by Bandai in 2003. During its lifespan, no variation of the WonderSwan was released outside Japan.  Powered by a 16-bit central processing unit, the WonderSwan took advantage of a low price point and long battery life in comparison to its competition, Nintendo's Game Boy Color and SNK's Neo Geo Pocket Color. Later improvements took advantage of quality upgrades to the handheld's screen and added color. The WonderSwan is playable both vertically and horizontally, and features a unique library of games, including numerous first-party titles based on licensed anime properties, as well as significant third-party support from Square, Namco, and Taito.  Overall, the WonderSwan in all its variations combined to sell an estimated 3.5 million units and managed to obtain as much as 8% of the Japanese handheld video game console market before being marginalized by Nintendo's Game Boy Advance. Retrospective feedback praises the potential of the WonderSwan despite its low sales and its brief time holding its own against Nintendo in the marketplace.",Handhelds
WonderSwan Color,true,2000-12-09,"Bandai Co., Ltd.","Bandai Co., Ltd.",NEC V30MZ @ 3 MHz,64 KB,241 Colors,4 channels,224x144,Cartridge,1,"The WonderSwan Color was released on December 9, 2000 (only in Japan). It was created by Bandai, and the successor to the original WonderSwan. In Japan, it was met with modest success and sales (especially considering Nintendo's near-monopoly of the handheld market). The market share of the WonderSwan Color was approximately 8%, according to Bandai. Much of this success is credited to the low price of the handheld; ¥6800, or $59. The WonderSwan Color also had great third party support, with companies such as Squaresoft (who ported many of the original Final Fantasy games to the WonderSwan Color). When the WonderSwan Color's successor, the SwanCrystal, was released, Nintendo had regained support of Squaresoft, however. One of the unique features of the WonderSwan (all versions) was the fact that it could be played either horizontally or vertically.",Handhelds
Magnavox Odyssey 2,true,1978-12-01,Magnavox / Philips,Magnavox / Philips,Intel 8048,64 bytes,Intel 8244 (NTSC) or 8245 (PAL),"1 channel, handled by the graphics chip",160x200,ROM cartridge,2,"The Magnavox Odyssey 2 is a second generation (1976–1992) home video game console developed and distributed by Magnavox. It was released in February 1979 in North America at a retail price of $179. The console was also released in Europe (1979), and later South America (1983), and Japan (1982). The Odyssey 2 included a full alphanumeric membrane keyboard, which was to be used for educational games, selecting options, or programming. The console was discontinued on March 20, 1984.",Consoles
Fairchild Channel F,true,1976-11-01,Fairchild Semiconductor,Fairchild Semiconductor,Fairchild F8 (2-chip cpu),"64 bytes main RAM, 2 KB video RAM",N/A,"120, 500, 1000 Hz beeps modulatable",128x64,ROM cartridge,2,"The Fairchild Channel F is a home video game console released by Fairchild Semiconductor in November 1976.

It has the distinction of being the first programmable ROM cartridge–based video game console, and the first console to use a microprocessor. It was launched as the Video Entertainment System, or VES, but when Atari released their VCS the next year, Fairchild renamed it's machine.",Consoles
BBC Microcomputer System,true,1981-12-01,Acorn Computers,Acorn Computers,MOS Technology 6502A/6512A,"16 KB, 32 KB, 64 KB, 128 KB",Motorola 6845 and Mullard SAA5050 Teletext,"Texas Instruments SN76489, 4 channels, mono","8 modes: 5 graphics, 2 text only and 1 Teletext","Cassette tape, Floppy disc, Winchester HD",2,"The British Broadcasting Corporation Microcomputer System, BBC Microcomputer System, or best known as the BBC Micro is a series of microcomputers designed by Acorn Computers Ltd. and distributed by the BBC. The first models were released in December 1981 in Europe for £235 or £335, depending on the model. The computers were also released in North America (1983). The computers were designed with an emphasis on education, and being more rugged then other brands. The computers were manufactured until an unspecified time in 1994.",Computers
Memotech MTX512,true,1983-06-01,Memotech,Memotech,Zilog Z80A,64 KB fitted (512 KB max),Texas TMS 9929A (PAL) TMS 9918 (NTSC),TI SN76489AN (4 channels - 3 voice 1 noise),256x192 (3 modes - 2 graphics 1 text),Cassette tape,2,"Like many of the other computers at the time, including the Sinclair ZX range, Memotech computers were based on the Zilog Z80 8-bit microprocessor. The computers were originally available in two models, the MTX500 with 32KBytes of RAM and the MTX512 with 64KBytes of RAM. The MTX500 was launched at the Earls Court Computer Fair in June 1983 and the MTX512 was available later in the year.

The final machine from Memotech Computers, released in September 1984, was the RS128. The RS128 was fitted with 128 KBytes of RAM and used page switching to get around the Z80 restriction of only being able to address a maximum of 64KBytes of RAM.",Computers
Camputers Lynx,true,1983-01-01,Camputers,Camputers,Z80A,"48 KB, 96KB, 128 KB, 192KB",Motorola 6845,4-bit DAC,256x252 8 colours,"Cassette tape, Floppy disc (optional)",,"The Lynx was an 8-bit British home computer that was first released in early 1983 as a 48 kB model. Several models were available with 48 kB, 96 kB or 128 kB RAM. It was possible to reach 192 kB with RAM expansions on board. John Shireff designed the hardware and Davis Jansons the firmware.

The machine was based around a Z80A CPU clocked at 4 MHz, (6 MHz for the 128/192 kB models) and featured a Motorola 6845 as video controller. It was possible to run CP/M with the optional 5.25"" floppy disk-drive on the 96 kB and 128 kB models

Compared to, for example, the Commodore 64, the BASIC was more extensive and faster and resolution of graphics was better; but computer games on the other hand suffered from the special implementation and lack of hardware for sound and sprites. Thus, it was better for exploring programming or working with maths.",Computers
Tiger Game.com,true,1997-09-01,Tiger Electronics,Tiger Electronics,Sharp SM8521,N/A,Sharp SM8521,8-bit PCM and FM synthesis,200x160 4 shade grayscale,ROM cartridge,,"The Game.com is a fifth-generation handheld game console released by Tiger Electronics in August 1997. A smaller version, the Game.com Pocket Pro, was released in mid-1999. The first version of the Game.com can be connected to a 14.4 kbit/s modem for Internet connectivity, hence its name referencing the top level domain .com. It was the first video game console to include a touchscreen and the first handheld console to include Internet connectivity. The Game.com sold less than 300,000 units and was discontinued in 2000 because of poor sales. While the Game.com was a commercial failure, similar features were later used with great success by Nintendo in their DS handheld console. The Game.com was the first to include basic PDA-functions, the first to allow two game carts to be inserted at once, and the first handheld to allow internet access.",Handhelds
Oric Atmos,true,1984-01-01,Oric Products,Oric Products,MOS 6502A,48 KB,Semi-custom ASIC,GI 8912,200x240 graphics and 28x40 text mode,"Cassette tape, Microdisc, Floppy disc",,"The Oric Atmos was a British designed and built machine and was the successor to the Oric 1. Oric International to released the Oric Atmos, which added a true keyboard and an updated V1.1 ROM to the Oric-1.  Soon after the Atmos was released, the modem, printer and 3-inch floppy disk drive originally promised for the Oric-1 were announced and released by the end of 1984. Our Oric Atmos is on display in our main gallery.",Computers
Acorn Electron,true,1983-08-25,Acorn Computers,Acorn Computers,MOS Technology 6502A,32 KB,BBC Micro hardware emulated in software,1 sound channel and 1 emulated noise channel,5 graphics modes and 5 text,"Tape, Floppy disc, ROM cartridge",,"The Acorn Electron is a home computer designed by Acorn Computers Ltd. The computer was released in August 1983 in Europe at a retail price of £175. The computer was not released outside of Europe. The Electron was a budget version of the BBC Micro educational/home computer, and for a short period, the Electron was reportedly the best selling micro in the United Kingdom. The computer was manufactured until an unspecified time in 1985.",Computers
Dragon 32/64,true,1982-08-01,Dragon Data,Dragon Data,Motorola MC6809E,"32 KB, 64 KB",MC6847 VDG,N/A,Various modes,Cassette tape,2,"The Dragon 32 and Dragon 64 are home computers that were built in the 1980s. The Dragons are very similar to the TRS-80 Color Computer, and were produced for the European market by Dragon Data, Ltd., in Port Talbot, Wales, and for the US market by Tano of New Orleans, Louisiana.

A broad range of peripherals exist for the Dragon 32/64, and on top of this there are add-ons such as the Dragon's Claw which give the Dragons access to the BBC Micro's large range of accessories (a particularly important factor in the UK home market).

The Dragon uses analogue joysticks, unlike most systems of the time which used less versatile but cheaper digital systems. Other uses for the joystick ports include light pens.",Computers
Entex Adventure Vision,true,1982-01-01,Entex,Entex,Intel 8048,1 KB,"40x1 LED array and a spinning mirror, 15 fps",National Semiconductor COP411L,150x40,ROM cartridge,1,"The Adventurevision is a cartridge based tabletop video game system produced by Entex in 1982. The system has a rather unique built in LED display composed of a column of 40 LEDs and a spinning mirror that produced a display with a resolution of 150x40 pixels.

Another product using this technique was produced by Nintendo in the mid 1990s–the Virtual Boy.

Control is through a single multi-position joystick and two sets of four buttons, one on each side of the joystick, for ease of play by both left- and right-handed players.

Four game cartridges can be stored in  bays on top of the case.

With hindsight this seems inspired as ultimately only four games were released. Three were arcade ports, Defender, Super Cobra and Turtles and the fourth was an Asteroids clone called Space Force.

It's a very rare system (only 10,000 units were made, and only 1000 each of the 3 separate games), and due to it's fragile nature and moving parts not many have survived.

Boxed systems can sell for around 20 times the original retail price.",Consoles
APF Imagination Machine,true,1979-12-31,APF Electronics,APF Electronics,Motorola 6800,1 KB expandable to 17 KB,MC6847,1 channel,128x192 and 256x192 (8 and 4 colours),ROM cartridge,2,"The APF Imagination Machine is a combination home video game console and computer system released by APF Electronics Inc. in late 1979. It was composed of two separate components, the APF-M1000 game system, and an add on docking bay with full sized typewriter keyboard and tape drive. The APF-M1000 was built specifically to compete with the Atari 2600.",Consoles
Mattel Aquarius,true,1983-06-01,Radofin,Radofin,Zilog Z80A,4 KB expandable to 52 KB,N/A,1 voice expandable to 4,80x72 graphics and 40x24 text,"Cassette tape, ROM cartridge",,"The Mattel Aquarius was the first and only genuine home computer offered by Mattel Electronics. Mattel did not start by designing a computer. It instead began by looking around for a pre-made computer system it could market under its name. It discovered that one of its manufacturing partners, the Hong Kong based Radofin Electronics Far East, had already designed a three-system line of home computers. All Mattel had to do was secure the U.S. marketing rights, which it promptly did for the first two units in the line, and have Radofin handle the manufacturing.",Computers
Jupiter Ace,true,1982-01-01,Jupiter Cantab,Jupiter Cantab,Zilog Z80A,3 KB expandable to 17 KB,Independent sub-system 2 banks of 1 KB SRAM,1 channel buzzer,32x24 and 64x48 monochrome,Cassette tape,,"The Jupiter Ace was a British home computer of the early 1980s, produced by a company set up for the purpose, named Jupiter Cantab. The Ace differed from other microcomputers of the time in that it used Forth instead of the more common BASIC.",Computers
SAM Coupé,true,1989-01-01,MGT,MGT,Zilog Z80B,256 KB or 512 KB expandable to 4.5 MB max,VLSI ASIC,Phillips SAA1099 6 channel stereo,256x192 512x192,"Cassette tape, Floppy disc",1 (2 using a splitter),"In the last quarter of 1989 MGT launched the Sam Coupé. MGT was already known in the ZX Spectrum world for a range of hardware that they sold. The Sam was their pride and joy, and unfortunately to be their downfall.

The SAM name comes from a working name in the early design phases of ‘Some Amazing Machine’ (or ‘Some Amazing Micro’ or even ‘Spectrum Advanced Machine’ depending on who you talk to) and the ‘Coupé’ was a nickname because the machine resembles a fastback car in profile.",Computers
Enterprise,true,1985-01-01,Intelligent Software,Enterprise Computers,Zilog Z80A,64 KB or 128 KB,Nick ASIC,Dave ASIC,5 graphics and 2 text modes,"Cassette tape, ROM cartridge",2,"The Enterprise (aka Elan) is a Zilog Z80-based home computer first produced in 1985. It was developed by British company Intelligent Software and marketed by Enterprise Computers. Its two variants are the Enterprise 64, with 64 kilobytes (kB) of Random Access Memory (RAM), and the Enterprise 128, with 128 kB of RAM.",Computers
EACA EG2000 Colour Genie,true,1982-08-01,EACA,EACA,Zilog Z80,16 KB expandable to 32 KB,Motorola 6845,AY-3-8910,160x96 plus 40x24 text,"Tape, ROM cartridge, Floppy disc",2,The EACA EG2000 Colour Genie was a computer produced by Hong Kong-based manufacturer EACA and introduced in Germany in August 1982. It followed their earlier Video Genie I and II computers and was released around the same time as the business-oriented Video Genie III.,Computers
Acorn Archimedes,true,1989-06-18,Acorn Computers,Acorn Computers,"Type ARM2, Model VL2333-QC",4 MB,VIDC1a,8 channel stereo,Up to 1152x896,"Floppy disc, Hard disc 20 MB",,The Acorn Archimedes is a family of personal computers designed by Acorn Computers Ltd. The first models were released in June 1987 in Europe at a retail price around £800. The computers were also released in Australia (1988) and in limited availability in North America (1990). The Archimedes computers were one of the most powerful available during the late 1980s and early 1990s. The computers were manufactured until an unspecified time in 1995.,Computers
Tapwave Zodiac,true,2003-10-01,Tapwave,Tapwave,Motorola i.MX1 ARM9,"32 MB (Zodiac 1), 128 MB (Zodiac2 )",ATI Imageon W4200 2D,Yahama,480x320 half VGA,MMC / SD card,1 analog built in,"Tapwave, founded in May 2001 by former Palm executives, announced the Zodiac mobile entertainment console in May 2003 and began shipping in October 2003. Zodiac was designed to be a high-performance mobile entertainment system centered on games, music, photos, and video.

By running an enhanced version of the Palm Operating System (5.2T), Zodiac also provided access to Palm’s personal information management software and many other applications from the Palm developer community.  

The Zodiac console was initially available in two models, Zodiac 1 (32MB), and Zodiac 2 (128MB).

Some of the noteworthy game titles for the product included: Tony Hawk’s Pro Skater 4 (Activision); Mototrax (Activision); Spyhunter (Midway); Madden NFL 2005 – (EA/MDM); DOOM II (id Software); Golden Axe 3 and Altered Beast (Sega); Warfare Incorporated (Handmark); and Duke Nukem Mobile (3D Realms/MachineWorks).",Handhelds
Atari ST,true,1985-06-01,Atari,Atari,Motorola 68000,512 KB or 1 MB,Custom,YM2149F PSG,"320x200, 640x200, 640x400","Cartridge, Floppy disc",1,"The Atari ST is a line of home computers from Atari Corporation. The first models were released in June 1985 in North America at a retail price around $799.99 or $999.99, depending on the model. The computers were also released in limited availability in Europe (1985). The ST is the first personal computer to come with a bitmapped color GUI. The computers were manufactured until an unspecified time in 1993.",Computers
Bally Astrocade,true,1977-12-01,Midway,"Bally, Astrovision",Zilog Z80 @ 1.789 MHz,"4 KB RAM expandable to 64 KB, 8 KB ROM","Custom on-board chip, bitmap, 2 plane bitpacked","3 voices + noise/vibrato effects, (played through TV)",160x102 up to 320x204,Cartridge,4,"The Bally Astrocade, originally referred to as the Bally Home Library Computer, is a second generation (1976–1992) home video game console developed by Midway and distributed by Bally Manufacturing. It was released in late 1977 in North America at a retail price of $299. The console was not released outside North America. The Astrocade was known for having the most powerful graphics and sound capabilities for all consoles of it's era. The console was discontinued in mid to late 1983.",Consoles
Magnavox Odyssey,true,1972-05-01,Magnavox,Magnavox,None - discrete components only,None,White squares on a black background,None,N/A,Pin out cards,2,The Magnavox Odyssey is a first generation (1972–1980) home video game console developed and distributed by Magnavox. It was released in September 1972 in North America at a retail price of $99. The console was later released in Europe (1973). The Odyssey is the known to be the first commercial home video game console. The console was discontinued sometime in 1975.,Consoles
Emerson Arcadia 2001,true,1982-05-01,Emerson Radio,Emerson Radio,Signetics 2650,512 bytes,Signetics 2637 VDC,"2 channel, beep and noise",208x108,Cartridge,2,"Emerson Arcadia 2001 was supposed to be the Atari 2600 killer.  A great console with great games.  Unfortunately they fell prey to complete lack of third party development and the lack of arcade game titles.  Similar to other consoles before it, they were forced to release arcade clones.",Consoles
Sega SG-1000,true,1983-07-15,Sega,Sega,NEC 780C,"2 KB RAM, 16 KB video RAM",Texas Instruments TMS9928A VDC,"Texas Instruments SN76489, 4 channel mono",256x192,Cartridge,2,"Sega's SG-1000 (Sega Game 1000) (a.k.a Mark I) was the company's first attempt at home consoles.  It was initially test marketed in 1981 and finally released to Japanese consumers in July of 1983.  It was a pretty advanced system for its time and featured impressive technical specifications.  The system would be sold in Japan until 1985 and was released in various markets throughout European and Australasia.

In 1984, Sega released an updated version of the console called the SG-1000 Mark II.  This remodeled version used gamepads instead of the original joysticks and had mounts to store them on each side.  It also featured a slot which allowed a keyboard attachment called SK-1100 and was compatible with software from the Sega SC-3000 computer.  Sega also sold an optional adaptor called Card Catcher.  This adaptor would allow the SG-1000 to play Sega ""Game Card"" software.",Consoles
